{
  "aarm_decision": {
    "decided_at": "2026-09-30T09:00:00.050000Z",
    "decision": "MODIFY",
    "modified_parameters": {
      "amount": "100.00",
      "currency": "EUR",
      "from": "acct-1",
      "to": "acct-9"
    }
  },
  "aarm_version": "1.0",
  "inputs": [
    {
      "class": "verifiable",
      "effect": "none",
      "input": "urn:example:input:payments-policy",
      "reference": {
        "digest": {
          "algorithm": "ecl.digest.sha-256.v1",
          "value": "d7c1fbc8fa10cb2db45f0eaa29248a6d7c67529b887091c43c85711b3897ab91"
        },
        "uri": "urn:example:input-value:payments-policy"
      },
      "required": true,
      "source": "urn:example:source:payments-policy",
      "status": "available"
    }
  ],
  "request": {
    "action": {
      "action_class": "ecl.action.ai-proposed-operation.v1",
      "action_id": "https://externalcontrollayer.ai/ns/action/sha256/5fb553346529a0d17257dd3933ea0cd68cfaf73fdccaefa96ea3c37ad20fcdc5",
      "operation": "payments.transfer",
      "parameters": {
        "amount": "250.00",
        "currency": "EUR",
        "from": "acct-7",
        "to": "acct-9"
      },
      "parameters_digest": {
        "algorithm": "ecl.digest.sha-256.v1",
        "value": "884d82eb770272184eaca6c20a8e89cdc05b6e2e65b990fe201145b51dc1d900"
      },
      "required_evidence_profile": "ecl.evidence.standard.v1",
      "risk_class": "ecl.risk.high.v1",
      "target": {
        "digest": {
          "algorithm": "ecl.digest.sha-256.v1",
          "value": "bff38211e4b72e3186152eacaebe2f97a96bd11a1477f25be90ba321668e22c2"
        },
        "uri": "https://externalcontrollayer.ai/ns/target/sha256/bff38211e4b72e3186152eacaebe2f97a96bd11a1477f25be90ba321668e22c2"
      }
    },
    "actor": {
      "id": "urn:example:agent:bindings",
      "trust_domain": "urn:example:trust-domain:bindings",
      "type": "ecl.principal.workload.v1"
    },
    "authority_request": {
      "audience": "urn:example:enforcement-point:bindings",
      "requested_validity_seconds": 30,
      "use_policy": "single_use"
    },
    "constraints": {},
    "delegation_chain": [],
    "expires_at": "2026-09-30T09:00:30.000000Z",
    "extensions": [],
    "integrity_policy": {
      "accepted_suites": [
        "ecl.sig.ed25519.v1"
      ],
      "eligible_key_ids": [
        "urn:example:key:bindings-dcmp"
      ],
      "required": true,
      "required_key_ids": [
        "urn:example:key:bindings-dcmp"
      ],
      "revocation_policy": "ecl.revocation.offline-bundle.v1",
      "threshold": 1,
      "trust_policy": {
        "digest": {
          "algorithm": "ecl.digest.sha-256.v1",
          "value": "1111111111111111111111111111111111111111111111111111111111111111"
        },
        "epoch": 1,
        "id": "urn:example:trust-policy:bindings",
        "version": "2026-09-30"
      },
      "verification_time_policy": "ecl.time.issued-at.v1"
    },
    "issued_at": "2026-09-30T09:00:00.000000Z",
    "issuer": {
      "id": "urn:example:agent:bindings",
      "trust_domain": "urn:example:trust-domain:bindings",
      "type": "ecl.principal.workload.v1"
    },
    "message_id": "https://externalcontrollayer.ai/ns/message/sha256/ebc848a81064603829bc85719dc7f481b11790766fb099834654ce44167f783c",
    "message_type": "decision_request",
    "protocol": "DCMP-2",
    "schema_version": "2.0",
    "subject": {
      "id": "urn:example:tenant:bindings",
      "trust_domain": "urn:example:trust-domain:bindings",
      "type": "ecl.principal.tenant.v1"
    },
    "workflow": {
      "attempt": 1,
      "causal_predecessors": [],
      "root_trace_id": "urn:example:trace:aarm-modify-not-applied",
      "sequence": 1,
      "workflow_id": "urn:example:workflow:aarm-modify-not-applied"
    }
  },
  "response": {
    "decision_id": "https://externalcontrollayer.ai/ns/decision/sha256/c7df035404da88df77c6a3c85c5a48b1c0b1c84616f138152f06bc39169b1770",
    "evaluated_at": "2026-09-30T09:00:00.100000Z",
    "expires_at": "2026-09-30T09:00:15.100000Z",
    "extensions": [
      {
        "critical": true,
        "id": "ecl.ext.decision-basis.v1",
        "value": {
          "inputs": [
            {
              "class": "verifiable",
              "effect": "none",
              "input": "urn:example:input:payments-policy",
              "reference": {
                "digest": {
                  "algorithm": "ecl.digest.sha-256.v1",
                  "value": "d7c1fbc8fa10cb2db45f0eaa29248a6d7c67529b887091c43c85711b3897ab91"
                },
                "uri": "urn:example:input-value:payments-policy"
              },
              "required": true,
              "source": "urn:example:source:payments-policy",
              "status": "available"
            }
          ],
          "register": {
            "digest": {
              "algorithm": "ecl.digest.sha-256.v1",
              "value": "623fcf140727bacfacf4eb3a651ee945cfd430fb62107390354108c08603c52b"
            },
            "uri": "urn:example:register:bindings",
            "version": "2026-09-30"
          }
        },
        "version": 1
      }
    ],
    "integrity_policy": {
      "accepted_suites": [
        "ecl.sig.ed25519.v1"
      ],
      "eligible_key_ids": [
        "urn:example:key:bindings-dcmp"
      ],
      "required": true,
      "required_key_ids": [
        "urn:example:key:bindings-dcmp"
      ],
      "revocation_policy": "ecl.revocation.offline-bundle.v1",
      "threshold": 1,
      "trust_policy": {
        "digest": {
          "algorithm": "ecl.digest.sha-256.v1",
          "value": "1111111111111111111111111111111111111111111111111111111111111111"
        },
        "epoch": 1,
        "id": "urn:example:trust-policy:bindings",
        "version": "2026-09-30"
      },
      "verification_time_policy": "ecl.time.issued-at.v1"
    },
    "issued_at": "2026-09-30T09:00:00.100000Z",
    "issuer": {
      "id": "urn:example:decision-point:bindings",
      "trust_domain": "urn:example:trust-domain:bindings",
      "type": "ecl.principal.service.v1"
    },
    "message_id": "https://externalcontrollayer.ai/ns/message/sha256/38a74520df40ac00c407747a99554483b0153bcf783e484e82f0921889817759",
    "message_type": "decision_response",
    "obligations": [],
    "outcome": "deny",
    "policy": {
      "digest": {
        "algorithm": "ecl.digest.sha-256.v1",
        "value": "eeeeeeeeeeeeeeeeeeeeeeeeeeeeeeeeeeeeeeeeeeeeeeeeeeeeeeeeeeeeeeee"
      },
      "epoch": 1,
      "id": "urn:example:policy:bindings",
      "version": "2026-09-30"
    },
    "protocol": "DCMP-2",
    "reasons": [
      {
        "code": "ecl.reason.native-policy-disposition.v1",
        "detail": "the policy did not permit it",
        "retryable": false
      }
    ],
    "request_id": "https://externalcontrollayer.ai/ns/message/sha256/ebc848a81064603829bc85719dc7f481b11790766fb099834654ce44167f783c",
    "safe_state": "ecl.state.restricted.v1",
    "schema_version": "2.0",
    "workflow": {
      "attempt": 1,
      "causal_predecessors": [
        {
          "digest": {
            "algorithm": "ecl.digest.sha-256.v1",
            "value": "dff374ce1b19bb9c667f9d141b48ac913a69ab9a25d90b5b31f16566a3699779"
          },
          "id": "https://externalcontrollayer.ai/ns/message/sha256/ebc848a81064603829bc85719dc7f481b11790766fb099834654ce44167f783c",
          "relation": "ecl.relation.responds-to.v1"
        }
      ],
      "root_trace_id": "urn:example:trace:aarm-modify-not-applied",
      "sequence": 2,
      "workflow_id": "urn:example:workflow:aarm-modify-not-applied"
    }
  },
  "role": "decision-layer",
  "schema_version": "ecl_aarm_exchange_v1"
}
