{
  "aarm_decision": {
    "decided_at": "2026-09-30T09:00:00.050000Z",
    "decision": "DENY"
  },
  "aarm_version": "1.0",
  "inputs": [
    {
      "class": "verifiable",
      "effect": "none",
      "input": "urn:example:input:payments-policy",
      "reference": {
        "digest": {
          "algorithm": "ecl.digest.sha-256.v1",
          "value": "d7c1fbc8fa10cb2db45f0eaa29248a6d7c67529b887091c43c85711b3897ab91"
        },
        "uri": "urn:example:input-value:payments-policy"
      },
      "required": true,
      "source": "urn:example:source:payments-policy",
      "status": "available"
    },
    {
      "class": "verifiable",
      "effect": "restricts",
      "input": "urn:example:input:account-balance",
      "required": true,
      "source": "urn:example:source:account-balance",
      "status": "unavailable"
    },
    {
      "aarm_requirement": "R3",
      "class": "judgment",
      "effect": "restricts",
      "input": "urn:example:input:aarm-intent-alignment",
      "reference": {
        "digest": {
          "algorithm": "ecl.digest.sha-256.v1",
          "value": "f8973af94d9237a2649374268dff283c3c06afacaf05ac1b0a5e5603cc740b96"
        },
        "uri": "urn:example:input-value:aarm-intent-alignment"
      },
      "required": false,
      "source": "urn:example:source:aarm-intent-alignment",
      "status": "available"
    }
  ],
  "request": {
    "action": {
      "action_class": "ecl.action.ai-proposed-operation.v1",
      "action_id": "https://externalcontrollayer.ai/ns/action/sha256/b4eee9f66a2833f255d78a67439ff87f8e57905c1c2e83a0fc3cde29492d8f64",
      "operation": "payments.transfer",
      "parameters": {
        "amount": "250.00",
        "currency": "EUR",
        "from": "acct-7",
        "to": "acct-9"
      },
      "parameters_digest": {
        "algorithm": "ecl.digest.sha-256.v1",
        "value": "884d82eb770272184eaca6c20a8e89cdc05b6e2e65b990fe201145b51dc1d900"
      },
      "required_evidence_profile": "ecl.evidence.standard.v1",
      "risk_class": "ecl.risk.high.v1",
      "target": {
        "digest": {
          "algorithm": "ecl.digest.sha-256.v1",
          "value": "bff38211e4b72e3186152eacaebe2f97a96bd11a1477f25be90ba321668e22c2"
        },
        "uri": "https://externalcontrollayer.ai/ns/target/sha256/bff38211e4b72e3186152eacaebe2f97a96bd11a1477f25be90ba321668e22c2"
      }
    },
    "actor": {
      "id": "urn:example:agent:bindings",
      "trust_domain": "urn:example:trust-domain:bindings",
      "type": "ecl.principal.workload.v1"
    },
    "authority_request": {
      "audience": "urn:example:enforcement-point:bindings",
      "requested_validity_seconds": 30,
      "use_policy": "single_use"
    },
    "constraints": {},
    "delegation_chain": [],
    "expires_at": "2026-09-30T09:00:30.000000Z",
    "extensions": [],
    "integrity_policy": {
      "accepted_suites": [
        "ecl.sig.ed25519.v1"
      ],
      "eligible_key_ids": [
        "urn:example:key:bindings-dcmp"
      ],
      "required": true,
      "required_key_ids": [
        "urn:example:key:bindings-dcmp"
      ],
      "revocation_policy": "ecl.revocation.offline-bundle.v1",
      "threshold": 1,
      "trust_policy": {
        "digest": {
          "algorithm": "ecl.digest.sha-256.v1",
          "value": "1111111111111111111111111111111111111111111111111111111111111111"
        },
        "epoch": 1,
        "id": "urn:example:trust-policy:bindings",
        "version": "2026-09-30"
      },
      "verification_time_policy": "ecl.time.issued-at.v1"
    },
    "issued_at": "2026-09-30T09:00:00.000000Z",
    "issuer": {
      "id": "urn:example:agent:bindings",
      "trust_domain": "urn:example:trust-domain:bindings",
      "type": "ecl.principal.workload.v1"
    },
    "message_id": "https://externalcontrollayer.ai/ns/message/sha256/fd04fc1b0f0948c44b9b2f692e88f04568241477fe7675bb9390b2ff96b91373",
    "message_type": "decision_request",
    "protocol": "DCMP-2",
    "schema_version": "2.0",
    "subject": {
      "id": "urn:example:tenant:bindings",
      "trust_domain": "urn:example:trust-domain:bindings",
      "type": "ecl.principal.tenant.v1"
    },
    "workflow": {
      "attempt": 1,
      "causal_predecessors": [],
      "root_trace_id": "urn:example:trace:aarm-basis-deny",
      "sequence": 1,
      "workflow_id": "urn:example:workflow:aarm-basis-deny"
    }
  },
  "response": {
    "decision_id": "https://externalcontrollayer.ai/ns/decision/sha256/e1b566d2a9a32a1a5e991444589d7bde2073c554473733ec93ee95b56bec1065",
    "evaluated_at": "2026-09-30T09:00:00.100000Z",
    "expires_at": "2026-09-30T09:00:15.100000Z",
    "extensions": [
      {
        "critical": true,
        "id": "ecl.ext.decision-basis.v1",
        "value": {
          "inputs": [
            {
              "class": "verifiable",
              "effect": "none",
              "input": "urn:example:input:payments-policy",
              "reference": {
                "digest": {
                  "algorithm": "ecl.digest.sha-256.v1",
                  "value": "d7c1fbc8fa10cb2db45f0eaa29248a6d7c67529b887091c43c85711b3897ab91"
                },
                "uri": "urn:example:input-value:payments-policy"
              },
              "required": true,
              "source": "urn:example:source:payments-policy",
              "status": "available"
            },
            {
              "class": "verifiable",
              "effect": "restricts",
              "input": "urn:example:input:account-balance",
              "required": true,
              "source": "urn:example:source:account-balance",
              "status": "unavailable"
            },
            {
              "class": "judgment",
              "effect": "restricts",
              "input": "urn:example:input:aarm-intent-alignment",
              "reference": {
                "digest": {
                  "algorithm": "ecl.digest.sha-256.v1",
                  "value": "f8973af94d9237a2649374268dff283c3c06afacaf05ac1b0a5e5603cc740b96"
                },
                "uri": "urn:example:input-value:aarm-intent-alignment"
              },
              "required": false,
              "source": "urn:example:source:aarm-intent-alignment",
              "status": "available"
            }
          ],
          "register": {
            "digest": {
              "algorithm": "ecl.digest.sha-256.v1",
              "value": "623fcf140727bacfacf4eb3a651ee945cfd430fb62107390354108c08603c52b"
            },
            "uri": "urn:example:register:bindings",
            "version": "2026-09-30"
          }
        },
        "version": 1
      }
    ],
    "integrity_policy": {
      "accepted_suites": [
        "ecl.sig.ed25519.v1"
      ],
      "eligible_key_ids": [
        "urn:example:key:bindings-dcmp"
      ],
      "required": true,
      "required_key_ids": [
        "urn:example:key:bindings-dcmp"
      ],
      "revocation_policy": "ecl.revocation.offline-bundle.v1",
      "threshold": 1,
      "trust_policy": {
        "digest": {
          "algorithm": "ecl.digest.sha-256.v1",
          "value": "1111111111111111111111111111111111111111111111111111111111111111"
        },
        "epoch": 1,
        "id": "urn:example:trust-policy:bindings",
        "version": "2026-09-30"
      },
      "verification_time_policy": "ecl.time.issued-at.v1"
    },
    "issued_at": "2026-09-30T09:00:00.100000Z",
    "issuer": {
      "id": "urn:example:decision-point:bindings",
      "trust_domain": "urn:example:trust-domain:bindings",
      "type": "ecl.principal.service.v1"
    },
    "message_id": "https://externalcontrollayer.ai/ns/message/sha256/57fcffff5963d06f7f0c97e2897465f32eddb715d89682a33a82c8c7223d24a3",
    "message_type": "decision_response",
    "obligations": [],
    "outcome": "deny",
    "policy": {
      "digest": {
        "algorithm": "ecl.digest.sha-256.v1",
        "value": "eeeeeeeeeeeeeeeeeeeeeeeeeeeeeeeeeeeeeeeeeeeeeeeeeeeeeeeeeeeeeeee"
      },
      "epoch": 1,
      "id": "urn:example:policy:bindings",
      "version": "2026-09-30"
    },
    "protocol": "DCMP-2",
    "reasons": [
      {
        "code": "ecl.reason.native-policy-disposition.v1",
        "detail": "the policy did not permit it",
        "retryable": false
      }
    ],
    "request_id": "https://externalcontrollayer.ai/ns/message/sha256/fd04fc1b0f0948c44b9b2f692e88f04568241477fe7675bb9390b2ff96b91373",
    "safe_state": "ecl.state.restricted.v1",
    "schema_version": "2.0",
    "workflow": {
      "attempt": 1,
      "causal_predecessors": [
        {
          "digest": {
            "algorithm": "ecl.digest.sha-256.v1",
            "value": "a877086246e83271a98f74f5015325376379d6c893fa55c37ac51606ed0ba30c"
          },
          "id": "https://externalcontrollayer.ai/ns/message/sha256/fd04fc1b0f0948c44b9b2f692e88f04568241477fe7675bb9390b2ff96b91373",
          "relation": "ecl.relation.responds-to.v1"
        }
      ],
      "root_trace_id": "urn:example:trace:aarm-basis-deny",
      "sequence": 2,
      "workflow_id": "urn:example:workflow:aarm-basis-deny"
    }
  },
  "role": "decision-layer",
  "schema_version": "ecl_aarm_exchange_v1"
}
